{
  "apiVersion": "evaluator.antaeus.io/v0alpha2",
  "kind": "EvaluatorProfile",
  "metadata": {
    "name": "quickstart-fixture",
    "description": "Deterministic evaluator for the credential-free quickstart."
  },
  "spec": {
    "totalTimeoutMs": 2000,
    "credentialSlots": [],
    "evaluators": [
      {
        "id": "fixture-primary",
        "mode": "deterministic-fixture",
        "adapter": {
          "id": "io.antaeus.fixture",
          "version": "0.1.0"
        },
        "protocol": {
          "id": "io.antaeus.rule-match",
          "version": "v0alpha1"
        },
        "requiredCapabilities": ["json-input", "structured-rule-results"],
        "timeoutMs": 1000,
        "retry": {
          "maxAttempts": 1,
          "retryOn": []
        },
        "parameters": {
          "fixtureSet": "quickstart",
          "fixtureVersion": "v1"
        }
      }
    ],
    "routing": {
      "primary": "fixture-primary",
      "fallbacks": [],
      "confidence": {
        "enabled": false
      },
      "terminal": {
        "onIndeterminate": "review",
        "onFailure": "failure"
      }
    }
  }
}
