{
  "apiVersion": "evaluator.antaeus.io/v0alpha2",
  "kind": "EvaluatorProfile",
  "metadata": {
    "name": "clm-openai-fallback",
    "description": "Experimental self-hosted CLM evaluator with the OpenAI evaluator as an operational fallback when the CLM server is unavailable or times out."
  },
  "spec": {
    "totalTimeoutMs": 90000,
    "credentialSlots": [
      {
        "name": "openai-api-key"
      }
    ],
    "evaluators": [
      {
        "id": "clm-primary",
        "mode": "semantic",
        "adapter": {
          "id": "io.antaeus.systemone",
          "version": "0.1.0"
        },
        "protocol": {
          "id": "io.antaeus.rule-match",
          "version": "v0alpha1"
        },
        "requiredCapabilities": [
          "json-input",
          "structured-rule-results"
        ],
        "timeoutMs": 5000,
        "retry": {
          "maxAttempts": 1,
          "retryOn": []
        },
        "provider": "contrastive-lm",
        "model": "clm-latest",
        "parameters": {
          "endpoint": "http://127.0.0.1:8700"
        }
      },
      {
        "id": "openai-fallback",
        "mode": "semantic",
        "adapter": {
          "id": "io.antaeus.openai",
          "version": "0.1.0"
        },
        "protocol": {
          "id": "io.antaeus.rule-match",
          "version": "v0alpha1"
        },
        "requiredCapabilities": [
          "json-input",
          "structured-rule-results"
        ],
        "timeoutMs": 40000,
        "retry": {
          "maxAttempts": 2,
          "retryOn": [
            "timeout",
            "unavailable",
            "throttled"
          ],
          "initialBackoffMs": 500,
          "maxBackoffMs": 4000,
          "multiplier": 2
        },
        "provider": "openai",
        "model": "gpt-5.4-mini-2026-03-17",
        "instructionTemplate": {
          "id": "io.antaeus.openai.rule-match",
          "digest": "sha256:2074738685823fbc700b33fbf0cdd132a5ecff0df5b6efa9db0da74c1618ddfc"
        },
        "credentialSlot": "openai-api-key",
        "parameters": {
          "maxOutputTokens": 2048,
          "reasoningEffort": "low"
        }
      }
    ],
    "routing": {
      "primary": "clm-primary",
      "fallbacks": [
        "openai-fallback"
      ],
      "fallbackOn": [
        "timeout",
        "unavailable",
        "throttled"
      ],
      "confidence": {
        "enabled": false
      },
      "terminal": {
        "onIndeterminate": "review",
        "onFailure": "failure"
      }
    }
  }
}
