{"apiVersion":"evaluator.antaeus.io/v0alpha2","kind":"EvaluatorProfile","metadata":{"name":"numeric-identity"},"spec":{"credentialSlots":[],"evaluators":[{"adapter":{"id":"io.example.numeric","version":"1.0.0"},"id":"semantic-primary","mode":"semantic","parameters":{"value":1000},"protocol":{"id":"io.antaeus.rule-match","version":"v0alpha1"},"requiredCapabilities":["json-input","structured-rule-results"],"retry":{"maxAttempts":1,"retryOn":[]},"timeoutMs":1000}],"routing":{"confidence":{"enabled":false},"fallbacks":[],"primary":"semantic-primary","terminal":{"onFailure":"failure","onIndeterminate":"review"}},"totalTimeoutMs":2000}}
